,id,name,author,title,description,url,urlToImage,publishedAt,content
0,,The Intercept,Yasmin Santos,"Ela corria risco de vida por causa da gravidez, mas o Judiciário negou seu direito ao aborto","Após sofrer um AVC no parto, Aline reuniu as provas de que precisava para interromper a segunda gravidez, mas não bastou ter a lei ao seu lado. 
The post Ela corria risco de vida por causa da gravidez, mas o Judiciário negou seu direito ao aborto appeared fir…",https://theintercept.com/2022/06/06/aborto-risco-de-vida-judiciario/,https://theintercept.com/wp-uploads/sites/1/2022/06/tib_redes.jpg,2022-06-06T05:21:23Z,"Aline estava na fila de espera do SUS para a inserção do DIU quando descobriu que estava grávida. Fazia menos de um ano que a jovem enfrentara um adoecimento severo na primeira gestação, que culminou… [+16222 chars]"
1,,The Intercept,Jordan Smith,O cabo de guerra entre os estados dos EUA sobre o aborto e a liberdade reprodutiva,"Decisão da Suprema Corte dos EUA faz com que acesso aos direitos reprodutivos fique a cargo dos estados, gerando uma guerra legislativa entre vizinhos.
The post O cabo de guerra entre os estados dos EUA sobre o aborto e a liberdade reprodutiva appeared first …",https://theintercept.com/2022/06/30/aborto-eua-disputa-estados/,https://theintercept.com/wp-uploads/sites/1/2022/06/GettyImages-1239563030-redes.jpg,2022-06-30T07:00:56Z,"Aúltima clínica
 de abortos remanescente no Missouri fica a poucas quadras a oeste do famoso Parque Nacional Gateway Arch, que abraça o lado do Missouri do rio Mississippi. O corpo dágua, com apenas… [+39002 chars]"
2,,The Intercept,"Paula Guimarães, Bruna de Lara, Tatiana Dias","Vídeo: em audiência, juíza de SC induz menina de 11 anos grávida após estupro a desistir de aborto legal","Criança está há mais de um mês em um abrigo para que não tenha acesso a seu direito: um aborto legal.
The post Vídeo: em audiência, juíza de SC induz menina de 11 anos grávida após estupro a desistir de aborto legal appeared first on The Intercept.",https://theintercept.com/2022/06/20/video-juiza-sc-menina-11-anos-estupro-aborto/,https://theintercept.com/wp-uploads/sites/1/2022/06/boneca-redes.jpg,2022-06-20T11:02:03Z,"Uma criança de 11 anos, grávida após ser vítima de um estupro, está sendo mantida pela justiça de Santa Catarina em um abrigo há mais de um mês para evitar que faça um aborto legal. Dois dias após a … [+24743 chars]"
3,,The Intercept,Nayara Felizardo,"Entrevista: ‘Cérebro de fetos Yanomami tem 7 vezes mais mercúrio de garimpo que o de adultos’, diz médico","O pesquisador da Fiocruz Paulo Basta explica como o garimpo reproduz a lógica e os efeitos do processo de colonização dos portugueses.
The post Entrevista: ‘Cérebro de fetos Yanomami tem 7 vezes mais mercúrio de garimpo que o de adultos’, diz médico appeared …",https://theintercept.com/2022/06/07/yanomami-fetos-mercurio-garimp-paulo-basta/,https://theintercept.com/wp-uploads/sites/1/2022/06/yanomami-Selo-The-Intercept-Redes.jpg,2022-06-07T14:40:59Z,"O relatório
 “Yanomami sob Ataque“, produzido por associações que representam a etnia, não usa meias palavras para descrever a situação do seu povo: o território vive o pior momento de invasão garim… [+20155 chars]"
4,,The Intercept,Fabiana Moraes,O Judiciário e o Ministério Público estão descolados da realidade brasileira,"Casos como a investigação da mãe de Miguel por racismo e o impedimento de uma criança de realizar um aborto são exemplos disso.
The post O Judiciário e o Ministério Público estão descolados da realidade brasileira appeared first on The Intercept.",https://theintercept.com/2022/06/28/judiciario-ministerio-publico-descolados-realidade-brasileira/,https://theintercept.com/wp-uploads/sites/1/2022/06/coluna-judiciario-fabi-redes.jpg,2022-06-28T06:00:03Z,"Ilustração: Rodrigo Bento/The Intercept Brasil; Getty Images
Caso 1: O juiz José Renato Bizerra, titular da 1ª Vara dos Crimes contra a Criança e o Adolescente da Capital, solicitou ao Ministério Pú… [+19090 chars]"
5,,Tecmundo.com.br,Acácio Moraes,HIV: novo tratamento experimental pode combater infecção com injeção única,"Pesquisadores desenvolveram uma nova injeção que pode revolucionar a vida de pacientes com HIV, o vírus causador da Aids. Segundo novo estudo publicado na revista científica Nature Biotechnology, no futuro será possível se livrar da infecção pelo HIV com uma …",https://www.tecmundo.com.br/ciencia/240380-hiv-novo-tratamento-experimental-combater-infeccao-injecao-unica.htm,https://tm.ibxk.com.br/2022/06/15/15102713453093.jpg,2022-06-15T16:30:01Z,"Pesquisadores desenvolveram uma nova injeção que pode revolucionar a vida de pacientes com HIV, o vírus causador da Aids. Segundo novo estudo publicado na revista científica Nature Biotechnology, no … [+2262 chars]"
6,,Tecnoblog.net,Paula Alves,Quais modelos de Apple Watch vão atualizar para o watchOS 9?,"Confira quais modelos do relógio são compatíveis com a nova versão do sistema da Apple e algumas das funcionalidades do watchOS 9
Quais modelos de Apple Watch vão atualizar para o watchOS 9?",https://tecnoblog.net/responde/quais-modelos-de-apple-watch-vao-atualizar-para-o-watchos-9/,https://files.tecnoblog.net/wp-content/uploads/thumbs/2022/06/626079-thumb-serp-1200x675.jpg,2022-06-07T16:30:00Z,"Anunciado durante o evento WWDC22 (Worldwide Developers Conference de 2022), o watchOS 9 é a nova versão do sistema operacional do Apple Watch, relógio inteligente da Apple. Com novidades que vão des… [+2143 chars]"
7,,Publico.pt,publico@publico.pt,Vítimas acusam casal em Portugal de enganar benfeitores em vários países,"Um casal que vive em Portugal aproveitou a crise humanitária da Ucrânia para burlar dinheiro a doadores através de iniciativas falsas para apoio de distribuição de bens, de adopção de animais e de retirada de refugiados.",https://www.publico.pt/2022/06/01/mundo/noticia/ucrania-vitimas-acusam-casal-portugal-enganar-benfeitores-varios-paises-2008511,https://imagens.publico.pt/imagens.aspx/1701889?tp=UH&db=IMAGENS&type=JPG&share=1&o=BarraFacebook_Publico.png,2022-06-01T11:57:33Z,"As autoridades portuguesas estão a investigar um casal que vive em Portugal e que pede donativos para ajudar pessoas e animais na Ucrânia, depois de denúncias de burla, algumas das quais a Lusa teve … [+6549 chars]"
8,,Sapo.pt,Pedro Simões,Apple WWDC 22: Recorde agora tudo o que a Apple apresentou no seu evento,"A WWDC de 2022 era muito esperada, por se saber que iam chegar muitas novidades nos vários sistemas da Apple. A empresa sempre surpreende nestes momentos e revela o que de melhor tem preparado...",https://pplware.sapo.pt/apple/apple-wwdc-22-recorde-agora-tudo-o-que-a-apple-apresentou-no-seu-evento/,https://pplware.sapo.pt/wp-content/uploads/2022/06/wwdc_2022_1.jpg,2022-06-06T23:30:07Z,"A WWDC de 2022 era muito esperada, por se saber que iam chegar muitas novidades nos vários sistemas da Apple. A empresa sempre surpreende nestes momentos e revela o que de melhor tem preparado para o… [+9573 chars]"
9,,BBC News,https://www.facebook.com/bbcnews,Venezuela: 5 sinais de recuperação — com limites — da economia da Venezuela,"Depois de anos em profunda crise, algo está mudando na economia venezuelana, que começa a mostrar alguns sinais favoráveis.",https://www.bbc.com/portuguese/internacional-61798960,https://ichef.bbci.co.uk/news/1024/branded_portuguese/170C8/production/_125380449_gettyimages-1227882036.jpg,2022-06-21T13:13:32Z,"<ul><li>Ángel Bermúdez (@angelbermudez)</li><li>BBC News Mundo</li></ul>
Crédito, Getty Images
Legenda da foto, A dolarização deu maior estabilidade à economia
""Venezuela foi consertada"" é uma fra… [+13664 chars]"
10,,BBC News,https://www.facebook.com/bbcnews,Testes rápidos para covid são confiáveis? O que revelam pesquisas nos EUA,"Testes caseiros, amplamente disponíveis em farmácias, podem ser ferramenta fundamental para ajudar a reduzir propagação da doença durante surto.",https://www.bbc.com/portuguese/geral-61922582,https://ichef.bbci.co.uk/news/1024/branded_portuguese/10FA4/production/_125604596_gettyimages-1361929801.jpg,2022-06-27T10:15:26Z,"<ul><li>Nathaniel Hafer e Apurv Soni</li><li>The Conversation*</li></ul>
Crédito, Getty Images
Desde maio de 2022, os Estados Unidos estão vivendo outro aumento no número de casos de covid-19.
Alt… [+7979 chars]"
11,,BBC News,https://www.facebook.com/bbcnews,O que a história de fracasso do viagra feminino ensina sobre a sexualidade das mulheres,Não foi por falta de tentativa: a indústria farmacêutica gastou milhões em busca de 'pílula rosa' - mas nunca conseguiu emplacar.,https://www.bbc.com/portuguese/geral-61654839,https://ichef.bbci.co.uk/news/1024/branded_portuguese/FFF9/production/_124992556_gettyimages-1053783564.jpg,2022-06-04T17:30:41Z,"<ul><li>Camilla Veras Mota - @cavmota</li><li>Da BBC News Brasil em São Paulo</li></ul>
Crédito, Getty Images
O viagra chegou às prateleiras em 1998 e se tornou um sucesso praticamente instantâneo … [+18018 chars]"
12,,BBC News,https://www.facebook.com/bbcnews,Câncer: 4 novidades que podem revolucionar tratamento da doença,"O maior congresso de oncologia do mundo trouxe avanços importantes que, na avaliação dos médicos, vão modificar a forma como se lida com alguns tipos de tumores.",https://www.bbc.com/portuguese/geral-61839292,https://ichef.bbci.co.uk/news/1024/branded_portuguese/14037/production/_125457918_gettyimages-1345262732.jpg,2022-06-26T18:21:18Z,"<ul><li>André Biernath - @andre_biernath</li><li>Da BBC News Brasil em Londres</li></ul>
Crédito, Getty Images
Legenda da foto, Tratamento de alguns tumores está passando por uma verdadeira revoluç… [+9677 chars]"
13,,BBC News,https://www.facebook.com/bbcnews,As mulheres dos EUA que viajam ao México para conseguir fazer aborto,Texas tem algumas das leis de aborto mais restritivas dos EUA. Conheça histórias de mulheres que procuram ajuda do outro lado da fronteira para interrupção voluntária da gravidez.,https://www.bbc.com/portuguese/internacional-61964905,https://ichef.bbci.co.uk/news/1024/branded_portuguese/1552B/production/_124793378_gettyimages-1235657573.jpg,2022-06-28T14:46:56Z,"<ul><li>Leire Ventas</li><li>Correspondente da BBC News Mundo em Los Angeles</li></ul>
Crédito, Getty Images
Aos 23 anos e com um bebê de apenas quatro meses, Anna* tinha certeza de que não poderia… [+16315 chars]"
14,,Abril.com.br,Da Redação,Seu cérebro avisa quando você cometeu um erro,Pesquisa nos EUA decifra mecanismo central para se aprender com a experiência – e que pode ser a causa do TOC,https://veja.abril.com.br/coluna/coluna-claudio-lottenberg/seu-cerebro-avisa-quando-voce-cometeu-um-erro/,https://veja.abril.com.br/wp-content/uploads/2021/07/cerebro-erika-onodera.jpg?quality=70&strip=info&w=680&h=453&crop=1,2022-06-22T12:26:55Z,"A OMS (Organização Mundial de Saúde) classifica o TOC (Transtorno Obsessivo-Compulsivo) como um transtorno de ansiedade, e diz que transtornos desse tipo são o sexto maior fator contribuinte para com… [+3323 chars]"
15,,BBC News,https://www.facebook.com/bbcnews,O país que abandonou guerra às drogas e agora tem até tempero à base de maconha,A Tailândia tem um dos regimes legais sobre maconha mais liberais do mundo. Como isso aconteceu?,https://www.bbc.com/portuguese/internacional-61879208,https://ichef.bbci.co.uk/news/1024/branded_portuguese/978A/production/_125549783_chidchanokchidchobtendinghermarijuanaplantsinburiram.jpg,2022-06-21T19:38:11Z,"Legenda da foto, Tailândia distribuiu mudas de maconha para estimular cultivo
A Tailândia legalizou o cultivo e o consumo de maconha este mês, revertendo uma abordagem linha-dura de longas sentenças… [+8186 chars]"
16,,BBC News,https://www.facebook.com/bbcnews,Como regime de Kim Jong-un está reagindo à tomada da Coreia do Norte pela covid,"O governo norte-coreado diz que tem a situação sob controle, mas o que realmente se sabe sobre o tamanho da crise?",https://www.bbc.com/portuguese/internacional-61678378,https://ichef.bbci.co.uk/news/1024/branded_portuguese/BCA0/production/_124988284_kjueu2hq.jpg,2022-06-05T15:28:10Z,"<ul><li>Jean Mackenzie, Hosu Le e equipe do Reality Check</li><li>BBC News</li></ul>
Crédito, Korean Central Television 
Legenda da foto, Pôster norte-coreano pergunta: 'camarada, você está seguind… [+9081 chars]"
17,,Www.jn.pt,JN/Agências,Refugiados acusam casal em Portugal de enganar benfeitores,"As autoridades portuguesas estão a investigar um casal que vive em Portugal e que pede donativos para ajudar pessoas e animais na Ucrânia, depois de denúncias de burla, algumas das quais a Lusa teve acesso.",https://www.jn.pt/justica/refugiados-acusam-casal-em-portugal-de-enganar-benfeitores--14906824.html,https://static.globalnoticias.pt/jn/image.jpg?brand=JN&type=generate&guid=988a9acc-d251-4978-95dc-26d66c962fbd&w=800&h=420&watermark=true&t=20220601122400,2022-06-01T11:39:09Z,"As autoridades portuguesas estão a investigar um casal que vive em Portugal e que pede donativos para ajudar pessoas e animais na Ucrânia, depois de denúncias de burla, algumas das quais a Lusa teve … [+6600 chars]"
18,,Www.jn.pt,JN/Agências,"Vacinas evitaram 19,8 milhões de mortes por covid-19","Desde a aprovação, em dezembro de 2020, as vacinas contra a covid-19 evitaram a morte de 19,8 milhões de pessoas, em 31,4 milhões de mortes potenciais, segundo o primeiro estudo que quantificou o impacto à escala mundial.",https://www.jn.pt/mundo/vacinas-evitaram-198-milhoes-de-mortes-por-covid-19-14964567.html,https://static.globalnoticias.pt/jn/image.jpg?brand=JN&type=generate&guid=278275d2-9fec-42b5-a50d-24fb3f54909d&w=800&h=420&watermark=true&t=20220624020100,2022-06-24T01:06:32Z,"Desde a aprovação, em dezembro de 2020, as vacinas contra a covid-19 evitaram a morte de 19,8 milhões de pessoas, em 31,4 milhões de mortes potenciais, segundo o primeiro estudo que quantificou o imp… [+3227 chars]"
19,,Www.jn.pt,Marisa Silva,"Falta ""estratégia"" para manter profissionais no SNS",Observatório Português dos Sistemas de Saúde aponta os recursos humanos como um dos desafios do setor público.,https://www.jn.pt/nacional/falta-estrategia-para-manter-profissionais-no-sns-14956840.html,https://static.globalnoticias.pt/jn/image.jpg?brand=JN&type=generate&guid=9e137f4b-902d-40c4-b5b0-a1b1221fffe2&w=800&h=420&watermark=true&t=20220621152000,2022-06-21T14:37:49Z,"Hoje às 15:20
Observatório Português dos Sistemas de Saúde aponta os recursos humanos como um dos desafios do setor público.
""Falta definir uma estratégia"" para fixar profissionais no Serviço Nacio… [+3324 chars]"
20,,Www.jn.pt,Maria Oliveira,Medicamento para tratar um tipo de alopecia perto de chegar à Europa,"Um medicamento para tratar a alopecia areata foi aprovado este mês nos Estados Unidos (EUA) e a Europa também já mostrou interesse em utilizar o fármaco. O baricitinib, medicamento em questão, já é usado para tratar a artrite reumatoide.",https://www.jn.pt/mundo/medicamento-para-tratar-um-tipo-de-alopecia-perto-de-chegar-a-europa-14963284.html,https://static.globalnoticias.pt/jn/image.jpg?brand=JN&type=generate&guid=76e009f2-e3da-4623-98f9-36d56a222f6f&w=800&h=420&watermark=true&t=20220623173600,2022-06-23T16:53:46Z,"Hoje às 17:36
Um medicamento para tratar a alopecia areata foi aprovado este mês nos Estados Unidos (EUA) e a Europa também já mostrou interesse em utilizar o fármaco. O baricitinib, medicamento em … [+3741 chars]"
21,,Catracalivre.com.br,Redação,Entenda o que é Rol Taxativo e por que ele te prejudica e beneficia somente planos de saúde,"A decisão do Superior Tribunal de Justiça (STJ) sobre ""rol taxativo"" favorece planos de saúde que lucraram R$ 20 bilhões em 2021 e prejudica a vida de",https://catracalivre.com.br/cidadania/rol-taxativo-te-prejudica-beneficia-planos-de-saude/,https://catracalivre.com.br/wp-content/uploads/2022/06/rol-taxativo-te-prejudica-beneficia-planos-de-saude.png,2022-06-13T18:15:08Z,A decisão do Superior Tribunal de Justiça (STJ) sobre “rol taxativo” favorece planos de saúde que lucraram R$ 20 bilhões em 2021 e prejudica a vida de milhares de pacientes que por causa desta caneta… [+11345 chars]
22,globo,Globo,,Adesão às práticas sustentáveis,"Adesão de empresas de saúde à agenda ESG tem avançado nos últimos anos, até pela necessidade de atender às parcelas da população mais afetadas pela pandemia de covid-19 – e pelo olhar cada vez mais atento da sociedade Por lidar diretamente com vidas humanas, …",https://valor.globo.com/empresas/noticia/2022/06/30/adesao-as-praticas-sustentaveis.ghtml,https://s2.glbimg.com/jymQ61werLjpgX8KYGZ3tHCHbKI=/1200x/smart/filters:cover():strip_icc()/i.s3.glbimg.com/v1/AUTH_63b422c2caee4269b8b34177e8876b93/internal_photos/bs/2022/1/h/8UL41DTeOhyXrcbcDuBw/esg-hospital-pacaembu-cred-edilson-20dantas-o-globo.jpg,2022-06-30T09:54:12Z,"Por lidar diretamente com vidas humanas, a prestação de serviços de saúde em todas as suas áreas de atuação, do desenvolvimento de novos medicamentos à internação hospitalar sempre esteve sujeita a u… [+312 chars]"
23,,Terra.com.br,DINO,Ações buscam conscientização para a miastenia,"Junho é o Mês da Miastenia, tema de evento online e gratuito promovido para pacientes com informações e atualizações sobre a condição, que pode dificultar a...","https://www.terra.com.br/noticias/acoes-buscam-conscientizacao-para-a-miastenia,bdcbcf363d9b9b374a41608f93492531i6sfz5cm.html",https://p2.trrsf.com/image/fget/cf/1200/630/middle/images.terra.com/2022/06/14/925085180-35e38f75-220e-43a1-b4e8-bf1fe55db006.jpg,2022-06-14T20:22:31Z,"Uma doença crônica, que afeta a comunicação das células nervosas e dos músculos, causando fraqueza muscular e fadiga. A miastenia é o tema da 2ª Semana da Miastenia, destinada a pacientes e familiare… [+5942 chars]"
24,,Terra.com.br,Estadão Conteúdo,Juíza de Santa Catarina nega aborto a menina de 11 anos vítima de estupro; TJ apura caso,"Magistrada apontou na decisão que gestação da criança já tinha mais de 22 semanas, o que impedia a interrupção da gravidez","https://www.terra.com.br/noticias/brasil/cidades/juiza-de-santa-catarina-nega-aborto-a-menina-de-11-anos-vitima-de-estupro-tj-apura-caso,ebfcc5d74f53d8e93ba48c25b8d2372deolk0sew.html",https://s1.trrsf.com/fe/zaz-mod-t360-icons/svg/logos/terra-16x9-borda.png,2022-06-21T09:11:38Z,"A Justiça de Santa Catarina negou que uma criança, de 11 anos, vítima de estupro e grávida de 29 semanas, de realizar um aborto autorizado. Em despacho expedido em 1º de junho, a magistrada Joana Rib… [+8075 chars]"
25,,Terra.com.br,Homework,App pra gerenciar rotina pet alcança meio milhão de animais,"Criado em 2018 por Rodrigo Real para gerenciar os cuidados da sua nova cadela Chiara, o ...","https://www.terra.com.br/economia/app-pra-gerenciar-rotina-pet-alcanca-meio-milhao-de-animais,73dce924e98b51b5da275efe07d413a3u0r9b70a.html",https://p2.trrsf.com/image/fget/cf/1200/630/middle/images.terra.com/2022/06/29/app-para-gerenciar-rotina-pet-1k1rqo03wpid4.jpg,2022-06-30T05:00:02Z,"Criado em 2018 por Rodrigo Real para gerenciar os cuidados da sua nova cadela Chiara, o aplicativo gratuito MeuPet acaba de alcançar a marca de meio milhão de pets cadastrados por mais de 300 mil tut… [+2814 chars]"
26,,Terra.com.br,Bebe.com,"""Descobri meu diabetes, não gestacional, ao saber que estava grávida""","Logo após o diagnóstico, Juliana Costa, editora-chefe do Bebê.com, teve uma perda gestacional. A seguir, ela conta como tudo isso transformou sua vida.","https://www.terra.com.br/vida-e-estilo/criancas/descobri-meu-diabetes-nao-gestacional-ao-saber-que-estava-gravida,83d1e22fd55b3ed855fc710c8858c84aq547isdq.html",https://p2.trrsf.com/image/fget/cf/1200/630/middle/images.terra.com/2022/06/26/1600527530-ilustracao-gravida-dia-nacional-diabetes.jpg,2022-06-26T13:18:50Z,"De acordo com dados do Atlas 2021 da Federação Internacional de Diabetes (IDF), o mundo conta com 537 milhões de indivíduos diabéticos com idade entre 20 e 79 anos. Por aqui, 15 milhões de brasileiro… [+9937 chars]"
27,,Www.dn.pt,Inês Schreck,31% dos utentes sem médico de família esperam há mais de dois anos,Cobertura está cada vez pior e reflete-se no acesso aos cuidados de saúde. Inscritos têm dificuldades em marcar consultas e enfrentam longas esperas.,https://www.dn.pt/sociedade/31-dos-utentes-sem-medico-de-familia-esperam-ha-mais-de-dois-anos-14967130.html,https://static.globalnoticias.pt/dn/image.jpg?brand=DN&type=generate&guid=f87c8c52-2265-4b1c-9566-1bbefd3f167b&w=800&h=420&watermark=true&t=20220624230200,2022-06-24T23:02:00Z,"A atribuição de médico de família a todos os portugueses é uma promessa política antiga, cada vez mais longe de ser concretizada. A esmagadora maioria dos residentes no país estão inscritos em centro… [+6485 chars]"
28,,Www.dn.pt,Artur Cassiano,O que se muda em 8 meses após 45 anos de poder de um só partido?,"Em algumas autarquias, a mudança foi um grito de Ipiranga - ""acabou o receio, o medo de represálias"". Noutras, o passado teimou em não sair -""houve uma tentativa de boicote"". E em quase todas os desafios são semelhantes: acabar com o abandono, combater o enve…",https://www.dn.pt/edicao-do-dia/16-jun-2022/o-que-se-muda-em-8-meses-apos-45-anos-de-poder-de-um-so-partido-14944528.html,https://static.globalnoticias.pt/dn/image.jpg?brand=DN&type=generate&guid=f7c7aa6d-500c-44d8-be55-b4736a66a7b3&w=800&h=420&watermark=true&t=20220616001900,2022-06-16T00:19:00Z,"A noite ""histórica"" de 26 de setembro, dizem os que ganharam, mudou 45 anos de poder: a queda de sete dos 31 bastiões que se mantinham desde 1976 nas mãos do mesmo partido. E mais uma vez, o PCP volt… [+25338 chars]"
29,,Abril.com.br,Renan Monteiro,Facebook e Instagram removem postagens sobre pílulas de aborto nos EUA,O porta-voz da Meta confirmou a proibição de negociações ou doações desses produtos,https://veja.abril.com.br/economia/facebook-e-instagram-removem-postagens-sobre-pilulas-de-aborto-nos-eua/,https://veja.abril.com.br/wp-content/uploads/2022/06/Facebook-e-Instagram-bloqueiam-posts-sobre-pilulas-abortivas-mesmo-fora-dos-EUA.jpg?quality=70&strip=info&w=680&h=453&crop=1,2022-06-28T18:04:32Z,"As redes sociais Instagram e Facebook adotaram políticas para a remoção de postagens sobre pílulas destinadas ao aborto nos EUA. A partir da manhã de sexta, 24, após a derrubada do direito constituci… [+1696 chars]"
30,,Abril.com.br,José Casado,Justiça liquida obscurantismo político no caso dos remédios de maconha,"Brasil, patina no preconceito, enquanto os Estados Unidos criam uma nova fronteira de negócios, para garantir a hegemonia no mercado mundial",https://veja.abril.com.br/coluna/jose-casado/justica-liquida-obscurantismo-politico-no-caso-dos-remedios-de-maconha/,https://veja.abril.com.br/wp-content/uploads/2021/05/MACONHA-ABRACE-JOAO-PESSOA-2019-87.jpeg.jpg?quality=70&strip=info&w=680&h=453&crop=1,2022-06-15T11:00:53Z,"O Judiciário liquidou um dogma, ontem, ao permitir o cultivo de maconha para uso medicinal.
O Superior Tribunal de Justiça julgou um trio de recursos de famílias atormentadas pela virtual proibição … [+2697 chars]"
31,,Abril.com.br,Paula Felix,"Restrição ao aborto nos EUA é combustível para oposição, diz especialista","Referência nos estudos e debates sobre o tema, Débora Diniz diz que há retrocesso global e decisão pode afetar países que ainda discutem descriminalização",https://veja.abril.com.br/saude/restricao-ao-aborto-nos-eua-e-combustivel-para-oposicao-diz-especialista/,https://veja.abril.com.br/wp-content/uploads/2018/07/brasil-debora-diniz-002.jpg?quality=70&strip=info&w=680&h=453&crop=1,2022-06-24T22:23:57Z,"Desde 1973, as mulheres norte-americanas tinham direito ao aborto até a 28ª semana de gestação por meio da decisão judicial conhecida como “Roe V. Wade”. Mas a proteção constitucional para o aborto l… [+3377 chars]"
32,,Abril.com.br,Paula Felix,"EUA aprovam tratamento de alopecia grave, condição que afeta Jada Smith",Doença autoimune causa queda de cabelo do couro cabeludo e de outras partes do corpo,https://veja.abril.com.br/saude/eua-aprovam-tratamento-de-alopecia-grave-condicao-que-afeta-jada-smith/,https://veja.abril.com.br/wp-content/uploads/2022/03/GettyImages-1388060436.jpg?quality=70&strip=info&w=680&h=453&crop=1,2022-06-14T16:19:42Z,"A Food and Drug Administration (FDA), agência reguladora dos Estados Unidos, aprovou nesta segunda-feira, 13, o remédio Olumiant (Baricitinibe) para o tratamento de alopecia areata, condição que afet… [+2329 chars]"
33,,Abril.com.br,Cilene Pereira,‘Chega de preconceito contra os deficientes’,"Iris Giuliani Assis, 17, sofre de doença rara e critica o modo como pessoas como ela ainda são tristemente excluídas",https://veja.abril.com.br/comportamento/chega-de-preconceito-contra-os-deficientes/,https://veja.abril.com.br/wp-content/uploads/2022/06/IMG_9199OK-1.jpg?quality=70&strip=info,2022-06-26T11:00:34Z,"Iris Giuliani Assis – Vinicius Garcia/.
Sofro de Atrofia muscular espinhal, conhecida como AME. É uma doença genética rara, neuromuscular e progressiva. O diagnóstico veio quando eu tinha 1 ano e 8 … [+3616 chars]"
