,id,name,author,title,description,url,urlToImage,publishedAt,content
95,,Cmjornal.pt,portal@cmjornal.pt (Correio da Manhã),"Médicos vão poder continuar a passar receitas à mão, revela Ministério da Saúde",Ordem dos Médicos tinha insistido no pedido para que a tutela alargasse o prazo.,https://www.cmjornal.pt/sociedade/detalhe/medicos-vao-poder-continuar-a-passar-receitas-a-mao-revela-ministerio-da-saude,https://cdn.cmjornal.pt/images/2022-06/img_1200x676$2022_06_21_10_55_30_1161242.jpg,2022-06-27T16:34:57Z,"Os médicos vão poder continuar a passar receitas à mão para além do prazo limite definido na portaria que regula o regime jurídico a que obedecem as regras de prescrição e dispensa de medicamentos, r… [+2336 chars]"
96,,Expresso.pt,Pedro Almeida,Primeiro medicamento para tratar a alopecia foi aprovado nos EUA,"Comprimido tem o nome de baricitinibe, pertence à farmacêutica americana Eli Lilly e está inserido numa classe de medicamentos utilizada para tratar doenças inflamatórias. Doença afeta mais de 300 mil pessoas anualmente só nos EUA",https://expresso.pt/sociedade/2022-06-14-Primeiro-medicamento-para-tratar-a-alopecia-foi-aprovado-nos-EUA-0ffbe049,https://images.impresa.pt/expresso/2022-06-14-pexels-towfiqu-barbhuiya-9755382.jpg-84a3a004/1.91x1?wm=true,2022-06-14T11:45:31Z,O primeiro comprimido para o tratamento da alopecia grave foi aprovado esta semana pela agência de medicamentos dos Estados Unidos (FDA). Trata-se de uma doença autoimune que atingirá pelo menos 10 m… [+2253 chars]
97,,Expresso.pt,Vera Lúcia Arreigoso,Cancro: Santa Maria testa fármacos inovadores a quem a esperança é a última coisa que lhe resta,Ensaios “pela primeira vez em humanos” vão ser feitos para consórcio americano,https://expresso.pt/sociedade/2022-06-09-Cancro-Santa-Maria-testa-farmacos-inovadores-a-quem-a-esperanca-e-a-ultima-coisa-que-lhe-resta-d69e5ef4,https://images.impresa.pt/expresso/2022-06-08-TM8867_T-_IDP.jpg-27d5e4fc/1.91x1?wm=true,2022-06-09T08:27:42Z,"É a derradeira esperança a quem já nada resta: o Hospital de Santa Maria, em Lisboa, vai abrir um centro para testar terapêuticas contra o cancro pela primeira vez em humanos, o momento zero dos ensa… [+957 chars]"
98,,Expresso.pt,Vera Lúcia Arreigoso,Cancro: Santa Maria testa fármacos inovadores a quem a esperança é a última coisa que lhe resta,Ensaios “pela primeira vez em humanos” vão ser feitos para consórcio americano,https://expresso.pt/sociedade/2022-06-12-Cancro-Santa-Maria-testa-farmacos-inovadores-a-quem-a-esperanca-e-a-ultima-coisa-que-lhe-resta-d69e5ef4,https://images.impresa.pt/expresso/2022-06-08-TM8867_T-_IDP.jpg-27d5e4fc/1.91x1?wm=true,2022-06-12T07:20:42Z,"É a derradeira esperança a quem já nada resta: o Hospital de Santa Maria, em Lisboa, vai abrir um centro para testar terapêuticas contra o cancro pela primeira vez em humanos, o momento zero dos ensa… [+957 chars]"
99,,Expresso.pt,Lusa,Vacinas contra a covid-19 já evitaram a morte de quase 20 milhões de pessoas,Estudo indica que se poderiam ter evitado outras 599.300 mortes em nações de baixo rendimento se tivesse sido cumprido o objetivo da Organização Mundial da Saúde de vacinar 40% da população de cada país até ao final de 2021,https://expresso.pt/coronavirus/2022-06-24-Vacinas-contra-a-covid-19-ja-evitaram-a-morte-de-quase-20-milhoes-de-pessoas-f1ba3f83,https://images.impresa.pt/expresso/2022-06-16-vacinas-covid-19-630502b1/1.91x1?wm=true,2022-06-24T07:26:44Z,"Desde a aprovação, em dezembro de 2020, as vacinas contra a covid-19 evitaram a morte de 19,8 milhões de pessoas, em 31,4 milhões de mortes potenciais, segundo o primeiro estudo que quantificou o imp… [+2914 chars]"
