,id,name,author,title,description,url,urlToImage,publishedAt,content
0,,BBC News,https://www.facebook.com/bbcnews,O que a história de fracasso do viagra feminino ensina sobre a sexualidade das mulheres,Não foi por falta de tentativa: a indústria farmacêutica gastou milhões em busca de 'pílula rosa' - mas nunca conseguiu emplacar.,https://www.bbc.com/portuguese/geral-61654839,https://ichef.bbci.co.uk/news/1024/branded_portuguese/FFF9/production/_124992556_gettyimages-1053783564.jpg,2022-06-04T17:30:41Z,"<ul><li>Camilla Veras Mota - @cavmota</li><li>Da BBC News Brasil em São Paulo</li></ul>
Crédito, Getty Images
O viagra chegou às prateleiras em 1998 e se tornou um sucesso praticamente instantâneo … [+18018 chars]"
1,,BBC News,https://www.facebook.com/bbcnews,Como regime de Kim Jong-un está reagindo à tomada da Coreia do Norte pela covid,"O governo norte-coreado diz que tem a situação sob controle, mas o que realmente se sabe sobre o tamanho da crise?",https://www.bbc.com/portuguese/internacional-61678378,https://ichef.bbci.co.uk/news/1024/branded_portuguese/BCA0/production/_124988284_kjueu2hq.jpg,2022-06-05T15:28:10Z,"<ul><li>Jean Mackenzie, Hosu Le e equipe do Reality Check</li><li>BBC News</li></ul>
Crédito, Korean Central Television 
Legenda da foto, Pôster norte-coreano pergunta: 'camarada, você está seguind… [+9081 chars]"
2,,Viomundo.com.br,Redação,"Cimi: A falta de água potável, remédios e de assistência médica ameaça a vida dos povos indígenas no Maranhão","Descaso do poder público com a saúde indígena
O post Cimi: A falta de água potável, remédios e de assistência médica ameaça a vida dos povos indígenas no Maranhão apareceu primeiro em Viomundo.",https://www.viomundo.com.br/denuncias/cimi-a-falta-de-agua-potavel-remedios-e-de-assistencia-medica-ameaca-a-vida-dos-povos-indigenas-no-maranhao.html,https://www.viomundo.com.br/wp-content/uploads/2022/06/escassez-de-remedios-nas-unidades-basicas-de-saude-indigena.-foto-itahu-ka-apor-scaled-001.jpg,2022-06-05T15:50:20Z,"Descaso do poder público e desassistência à saúde colocam em risco a vida de povos indígenas no Maranhão
Falta de água potável, escassez de remédios e desassistência médica estão entre os principais… [+9019 chars]"
3,,Uol.com.br,Gabriela Vinhal,,"O ministro da Defesa, general Paulo Sérgio Nogueira de Oliveira, foi convocado a ir na quarta-feira (8) à Comissão de Fiscalização Financeira e Controle da Câmara para prestar esclarecimentos sobre a compra de 35.320 comprimidos de Viagra pelas Forças Arm",https://noticias.uol.com.br/politica/ultimas-noticias/2022/06/03/camara-ministro-da-defesa-explica-compra-de-viagra-por-forcas-armadas.htm,https://conteudo.imguol.com.br/aa/2019/01/11/americano-se-empolga-exagera-na-dose-de-viagra-e-desenvolve-doenca-sem-cura-na-visao-1547251503707_615x300.png,2022-06-03T19:50:18Z,"O ministro da Defesa, general Paulo Sérgio Nogueira de Oliveira, foi convocado a ir na quarta-feira (8) à Comissão de Fiscalização Financeira e Controle da Câmara para prestar esclarecimentos sobre a… [+2450 chars]"
4,,Uol.com.br,Gabriela Vinhal,,"Em um ofício enviado à Câmara dos Deputados, o Ministério da Defesa justificou que a compra de 35 mil comprimidos de um medicamento genérico do Viagra foi feita para tratar 225 pacientes desde 2020.Encaminhado na quinta-feira (2), o documento, ao qual o U",https://noticias.uol.com.br/politica/ultimas-noticias/2022/06/04/defesa-diz-que-tratou-225-pessoas-apos-comprar-35-mil-comprimidos-de-viagra.htm,https://conteudo.imguol.com.br/c/entretenimento/b7/2018/03/27/viagra-1522154790984_v2_615x300.jpg,2022-06-04T09:06:57Z,"Em um ofício enviado à Câmara dos Deputados, o Ministério da Defesa justificou que a compra de 35 mil comprimidos de um medicamento genérico do Viagra foi feita para tratar 225 pacientes desde 2020.… [+2798 chars]"
5,,Expresso.pt,"Helena Bento, Tiago Miranda",Henrique Prata Ribeiro: “Gostaria que o novo plano de saúde mental dos Açores fosse um exemplo a nível internacional”,"O novo Programa Regional para a Saúde Mental dos Açores conta com a colaboração dos “sectores público, privado e social” e apresenta medidas como a implementação de um sistema de videoconferência para colmatar a falta de recursos humanos e o recrutamento de p…",https://expresso.pt/sociedade/2022-06-02-Henrique-Prata-Ribeiro-Gostaria-que-o-novo-plano-de-saude-mental-dos-Acores-fosse-um-exemplo-a-nivel-internacional-5e007937,https://images.impresa.pt/expresso/2022-06-02-henrique-prata-ribeiro-ae1b0e00/1.91x1?wm=true,2022-06-02T19:38:11Z,"Com um ""défice muito grande"" de psiquiatras metade do que é recomendado a nível internacional e uma taxa de suicídio que é superior à média em Portugal há vários anos, a região dos Açores assumiu o c… [+12408 chars]"
6,globo,Globo,,Vendas de antidepressivos genéricos no Brasil sobem mais de 50% em dois anos de pandemia,"Nos quatro primeiros meses do ano, o mercado total de genéricos cresceu 6,4% no país, depois da alta de cerca de 6% em 2021 As vendas de antidepressivos genéricos no Brasil cresceram expressivos 55,6% em dois anos de pandemia, confirmando que a covid-19 afeto…",https://valor.globo.com/empresas/noticia/2022/06/04/vendas-de-antidepressivos-genricos-no-brasil-sobem-mais-de-50-pontos-percentuais-em-dois-anos-de-pandemia.ghtml,https://s2.glbimg.com/aViQRHvoW6D5u8nfU16ejcAZf2U=/1200x/smart/filters:cover():strip_icc()/i.s3.glbimg.com/v1/AUTH_63b422c2caee4269b8b34177e8876b93/internal_photos/bs/2022/J/y/IPmcpQStOMAY1Q2NA40Q/james-yarema-kdginc0sdei-unsplash.jpg,2022-06-04T17:47:48Z,"As vendas de antidepressivos genéricos no Brasil cresceram expressivos 55,6% em dois anos de pandemia, confirmando que a covid-19 afetou também a saúde mental das pessoas, segundo levantamento da Ass… [+162 chars]"
7,,Jornaleconomico.pt,Ana Pina,"Economia Azul, um olhar a partir de Portugal","O trabalho que Portugal tem vindo a fazer de estudo permanente e dedicado do seu “Mar Portugal”, nomeadamente no quadro do alargamento da plataforma continental que corre atualmente nas Nações Unidas, é extremamente relevante. Portugal continua a ser um país …",https://jornaleconomico.pt/noticias/economia-azul-um-olhar-a-partir-de-portugal-901280,https://jornaleconomico.pt/wp-content/uploads/2022/06/Duarte-Alves_final.png,2022-06-02T23:16:01Z,"Há uns anos, quando trabalhava na Delegação de Portugal junto da OCDE, chegou-me às mãos um relatório que dizia que a República Checa era uma das campeãs europeias em aquacultura. Estranhei: um país … [+10709 chars]"
8,,Ig.com.br,saude@igcorp.com.br (BBC News Brasil),Covid: como regime de Kim Jong-un está reagindo ao aumento de casos,"O governo norte-coreado diz que tem a situação sob controle, mas o que realmente se sabe sobre o tamanho da crise?",https://saude.ig.com.br/2022-06-05/covid--como-regime-de-kim-jong-un-esta-reagindo-ao-aumento-de-casos.html,https://i0.statig.com.br/bancodeimagens/3e/3t/pf/3e3tpfdt2avatv6joqutdm8xo.jpg,2022-06-05T18:59:31Z,"Jean Mackenzie, Hosu Le e equipe do Reality Check - BBC News A Coreia do Norte anunciou seu primeiro caso de covid no início de maio. 
O governo do país afirma que o surto está sob controle, mas os … [+8950 chars]"
9,,Terra.com.br,BBC News Brasil,Como regime de Kim Jong-un está reagindo à tomada da Coreia do Norte pela covid,"O governo norte-coreado diz que tem a situação sob controle, mas o que realmente se sabe sobre o tamanho da crise?","https://www.terra.com.br/noticias/mundo/como-regime-de-kim-jong-un-esta-reagindo-a-tomada-da-coreia-do-norte-pela-covid,5c771ab2ac31e56c7b27a1df09915c44jcca0v0q.html",https://p2.trrsf.com/image/fget/cf/1200/630/middle/images.terra.com/2022/06/05/297350985-124988283kjueu2hq.jpg,2022-06-05T16:48:32Z,"A Coreia do Norte anunciou seu primeiro caso de covid no início de maio. 
O governo do país afirma que o surto está sob controle, mas os detalhes permanecem um mistério. A BBC reuniu informações con… [+8402 chars]"
10,globo,Globo,,Está na fila de auxílio-doença o INSS? Veja o que fazer para reduzir as chances de ter o benefício negado,"A fila de trabalhadores à espera de uma avaliação médica 
pericial do Instituto Nacional do Seguro Social (INSS) já passa de 1,1 milhão de 
pessoas, segundo dados do próprio órgão. Para diminuir a quantidade de segurados 
nesta situação, o governo...Leia mais",https://extra.globo.com/economia-e-financas/esta-na-fila-de-auxilio-doenca-inss-veja-que-fazer-para-reduzir-as-chances-de-ter-beneficio-negado-25521081.html,https://extra.globo.com/economia-e-financas/25521910-a0e-f52/w976h550-PROP/99432889.jpg,2022-06-05T09:30:14Z,"A fila de trabalhadores à espera de uma avaliação médica pericial do Instituto Nacional do Seguro Social (INSS) já passa de 1,1 milhão de pessoas, segundo dados do próprio órgão. Para diminuir a quan… [+8649 chars]"
11,globo,Globo,,Está na fila de auxílio-doença do INSS? Veja o que fazer para reduzir as chances de ter o benefício negado,"A fila de trabalhadores à espera de uma avaliação médica pericial do Instituto Nacional do Seguro Social (INSS) já passa de 1,1 milhão de pessoas, segundo dados do próprio órgão. Para diminuir a quantidade de segurados nesta situação, o governo...Leia mais",https://extra.globo.com/economia-e-financas/esta-na-fila-de-auxilio-doenca-do-inss-veja-que-fazer-para-reduzir-as-chances-de-ter-beneficio-negado-25521081.html,https://extra.globo.com/economia-e-financas/25521910-a0e-f52/w976h550-PROP/99432889.jpg,2022-06-05T09:30:14Z,"A fila de trabalhadores à espera de uma avaliação médica pericial do Instituto Nacional do Seguro Social (INSS) já passa de 1,1 milhão de pessoas, segundo dados do próprio órgão. Para diminuir a quan… [+8642 chars]"
12,,Terra.com.br,Boa Forma,Transtorno purgativo e outros distúrbios alimentares pouco conhecidos,"Mudanças no comportamento alimentar, preocupação excessiva com o corpo, os Transtornos ...","https://www.terra.com.br/vida-e-estilo/saude/transtorno-purgativo-e-outros-disturbios-alimentares-pouco-conhecidos,1eb6e7a78954a3890ca4f8ca695fbb9c09szz9j1.html",https://p2.trrsf.com/image/fget/cf/1200/630/middle/images.terra.com/2022/06/02/1424483189-szabolcs-toth-0u41mg8qhu-unsplash.jpg,2022-06-02T18:17:34Z,"Mudanças no comportamento alimentar, preocupação excessiva com o corpo, os Transtornos Alimentares (TAs) são quadros emocionais em que a pessoa apresenta uma alteração na sua relação com a comida e a… [+7740 chars]"
13,,Terra.com.br,BBC News Brasil,O que a história de fracasso do viagra feminino ensina sobre a sexualidade das mulheres,Não foi por falta de tentativa: a indústria farmacêutica gastou milhões em busca de 'pílula rosa' - mas nunca conseguiu emplacar.,"https://www.terra.com.br/noticias/ciencia/o-que-a-historia-de-fracasso-do-viagra-feminino-ensina-sobre-a-sexualidade-das-mulheres,7e6596038101c83f5bec7d1ffc55a9df2a3hn10v.html",https://p2.trrsf.com/image/fget/cf/1200/630/middle/images.terra.com/2022/06/04/1282691050-124992555gettyimages-1053783564.jpg,2022-06-04T17:36:49Z,"O viagra chegou às prateleiras em 1998 e se tornou um sucesso praticamente instantâneo de vendas. 
Descoberta por acaso pela Pfizer, a ""pílula azul"" se tornou uma máquina de fazer dinheiro. Só nos p… [+17071 chars]"
14,,R7.com,Do R7,Mentira sobre mísseis para crianças e filho na guerra: ucranianos relatam dramas antes de jogão,"Seleção tenta neste domingo, contra Gales, a classificação para a Copa do Mundo: 'O país está esperando por alguma felicidade'",http://esportes.r7.com/futebol/copa-do-mundo/fotos/mentira-sobre-misseis-para-criancas-e-filho-na-guerra-ucranianos-relatam-dramas-antes-de-jogao-05062022,https://img.r7.com/images/torcida-ucrania-guerra-ucrania-stop-war-03062022160357187?dimensions=1024x682,2022-06-05T05:00:13Z,"Os jogadores da Ucrânia estão divididos com a possibilidade de classificação para a Copa e o horror da guerra. Uma vitória diante do País de Gales neste domingo (5) coloca o país de novo no Mundial, … [+2379 chars]"
15,,R7.com,Folha Vitória,"“Sou um gago que fala para milhões”, brinca Renato Silveira, rei de emagrecer","Reconhecido por ter criado um método próprio para emagrecer, o farmacêutico tem mais de três dezenas de visualizações nas redes sociais, com mais de 1,5 milhão de seguidores só no Instagram",http://noticias.r7.com/cidades/folha-vitoria/sou-um-gago-que-fala-para-milhoes-brinca-renato-silveira-rei-de-emagrecer-05062022,https://img.r7.com/images/r7-30072019142631584?dimensions=340x191&crop_position=c,2022-06-05T22:49:48Z,"Foto: Reprodução/Arquivo Pessoal
 
 Renato Silveira tem milhões de fãs na internet. No Instagram, são 1,5 milhão de seguidores. No YouTube, outros mais de 1,2 milhão. Juntando outras redes, o farmacê… [+2317 chars]"
16,,Metropoles.com,Karolini Bandeira,Yanomamis: mortes por doenças infecciosas subiram 117% de 2016 a 2021,"Os óbitos são causados, principalmente, por malária. Nos últimos cinco anos, número de mortes saltou. Crianças são as principais vítimas
O post Yanomamis: mortes por doenças infecciosas subiram 117% de 2016 a 2021 apareceu primeiro em Metrópoles.",https://www.metropoles.com/brasil/yanomamis-mortes-por-doencas-infecciosas-subiram-117-de-2016-a-2021,http://uploads.metropoles.com/wp-content/uploads/2021/07/09100838/indigena-trigo-vacina-covid-19.jpg,2022-06-02T05:00:56Z,"A presença de garimpo ilegal não é a única ameaça à população indígena Yanomami. A contaminação por doenças infecciosas, como malária e tuberculose, mais do que dobrou nos últimos seis anos. Conforme… [+7894 chars]"
